{"status":"APPROVED","summary":"All DX-01 acceptance criteria are satisfied. Reviewed every tracked/untracked change, concurrency and state transitions, rollback/idempotency, security, and scope. No database/Alembic/PostgreSQL changes apply. Verified: 48 tests passed; bash syntax, git diff check, and systemd unit verification passed.","findings":[],"tests_required":[]}